{
  "schema_version": "1.0.0",
  "base_example": "method.example.json",
  "replacement_fields": {
    "generation_id": "generation.method.002",
    "summary": "Use a cross-fitted orthogonal score with a bounded propensity component to estimate the average treatment effect under limited overlap.",
    "canonical_artifact": {
      "artifact_id": "artifact.method_definition.exposition_revision",
      "uri": "artifact://artifact.method_definition.exposition_revision",
      "path": "generations/method_record/record.method.overlap_stabilized_score/generation.method.002/method.md",
      "sha256": "2222222222222222222222222222222222222222222222222222222222222222",
      "media_type": "text/markdown",
      "locator": "Formal method definition"
    },
    "definition_locator": "Formal method definition: overlap-stabilized orthogonal score",
    "lineage": {
      "predecessor": {
        "stable_id": "method.overlap_stabilized_score",
        "version": 1,
        "definition_sha256": "b274bbb26acde9604faad22d05b3f4015f75491a31b5d0f67f139a64f7a7a4f1"
      },
      "predecessor_generation_id": "generation.method.001",
      "change_class": "editorial",
      "change_summary": "Clarified the summary and reorganized the displayed definition without changing any calculation-defining field.",
      "change_source": {
        "kind": "research_run",
        "run_id": "run.p2.focused.20260716t120000z"
      }
    },
    "created_at": "2026-07-16T12:30:00Z",
    "updated_at": "2026-07-16T12:30:00Z",
    "publication_receipt_id": "publication.p2.method.002",
    "published_at": "2026-07-16T12:30:00Z"
  },
  "expected_relation": {
    "definition_sha256": "b274bbb26acde9604faad22d05b3f4015f75491a31b5d0f67f139a64f7a7a4f1",
    "base_content_sha256": "07967bb4c92015f307fe0296aa889092494535223e28f87c541b722faffeb5eb",
    "revised_content_sha256": "b9e104420881e3e1f21511d9fee1184880ffddec3ce8e411ec6078750bba77c3",
    "definition_unchanged": true,
    "artifact_changed": true,
    "whole_record_changed": true
  }
}
